ID,Abdullah Yusuf Ali,tag_1,tag_2
1|1,"In the name of Allah, Most Gracious, Most Merciful.",,"['allah-mercy', 'divine-love']"
1|2,"Praise be to Allah, the Cherisher and Sustainer of the worlds;",,"['divine-mercy', 'allah-power']"
1|3,"Most Gracious, Most Merciful;",,"['allah-mercy', 'divine-love']"
1|4,Master of the Day of Judgment.,,"['divine-justice', 'day-judgment']"
1|5,"Thee do we worship, and Thine aid we seek.",,"['spiritual-connection', 'divine-dependence']"
1|6,"Show us the straight way,",,"['divine-guidance', 'spiritual-direction']"
1|7,"The way of those on whom Thou hast bestowed Thy Grace, those whose (portion) is not wrath, and who go not astray.",,"['divine-guidance', 'spiritual-direction']"
2|1,A. L. M.,,"['Divine Mystery', 'Revelation Introduction']"
2|2,"This is the Book; in it is guidance sure, without doubt, to those who fear Allah;",,"['Divine Guidance', 'Righteous Fear']"
2|3,"Who believe in the Unseen, are steadfast in prayer, and spend out of what We have provided for them;",,"['Faith in Unseen', 'Righteous Deeds']"
2|4,"And who believe in the Revelation sent to thee, and sent before thy time, and (in their hearts) have the assurance of the Hereafter.",,"['Faith in Revelation', 'Assurance of Hereafter']"
2|5,"They are on (true) guidance, from their Lord, and it is these who will prosper.",,"['divine-guidance', 'spiritual-success']"
2|6,"As to those who reject Faith, it is the same to them whether thou warn them or do not warn them; they will not believe.",,"['Divine Justice', 'Faith Rejection']"
2|7,"Allah hath set a seal on their hearts and on their hearing, and on their eyes is a veil; great is the penalty they (incur).",,"['Divine Punishment', 'Spiritual Blindness']"
2|8,"Of the people there are some who say: ""We believe in Allah and the Last Day;"" but they do not (really) believe.",,"['hypocrisy-warning', 'faith-integrity']"
2|9,"Fain would they deceive Allah and those who believe, but they only deceive themselves, and realise (it) not!",,"['self-deception', 'divine-justice']"
2|10,"In their hearts is a disease; and Allah has increased their disease: And grievous is the penalty they (incur), because they are false (to themselves).",,"['spiritual-corruption', 'divine-justice']"
2|11,"When it is said to them: ""Make not mischief on the earth,"" they say: ""Why, we only Want to make peace!""",,"['hypocrisy-exposed', 'moral-deception']"
2|12,"Of a surety, they are the ones who make mischief, but they realise (it) not.",,"['Moral Blindness', 'Spiritual Deception']"
2|13,"When it is said to them: ""Believe as the others believe:"" They say: ""Shall we believe as the fools believe?"" Nay, of a surety they are the fools, but they do not know.",,"['hypocrisy-exposure', 'true-folly']"
2|14,"When they meet those who believe, they say: ""We believe;"" but when they are alone with their evil ones, they say: ""We are really with you: We (were) only jesting.""",,"['hypocrisy-exposure', 'faith-duplicity']"
2|15,"Allah will throw back their mockery on them, and give them rope in their trespasses; so they will wander like blind ones (To and fro).",,"['Divine Justice', 'Spiritual Blindness']"
2|16,"These are they who have bartered Guidance for error: But their traffic is profitless, and they have lost true direction,",,"['Spiritual Deception', 'Divine Judgment']"
2|17,"Their similitude is that of a man who kindled a fire; when it lighted all around him, Allah took away their light and left them in utter darkness. So they could not see.",,"['Divine Punishment', 'Spiritual Blindness']"
2|18,"Deaf, dumb, and blind, they will not return (to the path).",,"['Spiritual Blindness', 'Divine Judgment']"
2|19,"Or (another similitude) is that of a rain-laden cloud from the sky: In it are zones of darkness, and thunder and lightning: They press their fingers in their ears to keep out the stunning thunder-clap, the while they are in terror of death. But Allah is ever round the rejecters of Faith!",,"['Divine Warning', 'Spiritual Blindness']"
2|20,"The lightning all but snatches away their sight; every time the light (Helps) them, they walk therein, and when the darkness grows on them, they stand still. And if Allah willed, He could take away their faculty of hearing and seeing; for Allah hath power over all things.",,"['Divine Power', 'Spiritual Blindness']"
2|21,"O ye people! Adore your Guardian-Lord, who created you and those who came before you, that ye may have the chance to learn righteousness;",,"['divine-worship', 'righteous-living']"
2|22,"Who has made the earth your couch, and the heavens your canopy; and sent down rain from the heavens; and brought forth therewith Fruits for your sustenance; then set not up rivals unto Allah when ye know (the truth).",,"['Divine Providence', 'Monotheistic Worship']"
2|23,"And if ye are in doubt as to what We have revealed from time to time to Our servant, then produce a Sura like thereunto; and call your witnesses or helpers (If there are any) besides Allah, if your (doubts) are true.",,"['Divine Challenge', 'Revelation Authenticity']"
2|24,"But if ye cannot- and of a surety ye cannot- then fear the Fire whose fuel is men and stones,- which is prepared for those who reject Faith.",,"['hell-warning', 'divine-justice']"
2|25,"But give glad tidings to those who believe and work righteousness, that their portion is Gardens, beneath which rivers flow. Every time they are fed with fruits therefrom, they say: ""Why, this is what we were fed with before,"" for they are given things in similitude; and they have therein companions pure (and holy); and they abide therein (for ever).",,"['Divine Reward', 'Paradise Description']"
2|26,"Allah disdains not to use the similitude of things, lowest as well as highest. Those who believe know that it is truth from their Lord; but those who reject Faith say: ""What means Allah by this similitude?"" By it He causes many to stray, and many He leads into the right path; but He causes not to stray, except those who forsake (the path),-",,"['Divine Wisdom', 'Guidance and Misguidance']"
2|27,"Those who break Allah's Covenant after it is ratified, and who sunder what Allah Has ordered to be joined, and do mischief on earth: These cause loss (only) to themselves.",,"['Divine Covenant', 'Moral Accountability']"
2|28,"How can ye reject the faith in Allah?- seeing that ye were without life, and He gave you life; then will He cause you to die, and will again bring you to life; and again to Him will ye return.",,"['divine-power', 'life-after-death']"
2|29,"It is He Who hath created for you all things that are on earth; Moreover His design comprehended the heavens, for He gave order and perfection to the seven firmaments; and of all things He hath perfect knowledge.",,"['divine-creation', 'allah-power']"
2|30,"Behold, thy Lord said to the angels: ""I will create a vicegerent on earth."" They said: ""Wilt Thou place therein one who will make mischief therein and shed blood?- whilst we do celebrate Thy praises and glorify Thy holy (name)?"" He said: ""I know what ye know not.""",,"['Divine Sovereignty', 'Human Accountability']"
2|31,"And He taught Adam the names of all things; then He placed them before the angels, and said: ""Tell me the names of these if ye are right.""",,"['divine-knowledge', 'human-capability']"
2|32,"They said: ""Glory to Thee, of knowledge We have none, save what Thou Hast taught us: In truth it is Thou Who art perfect in knowledge and wisdom.""",,"['divine-knowledge', 'humility-recognition']"
2|33,"He said: ""O Adam! Tell them their names."" When he had told them, Allah said: ""Did I not tell you that I know the secrets of heaven and earth, and I know what ye reveal and what ye conceal?""",,"['divine-omniscience', 'prophetic-knowledge']"
2|34,"And behold, We said to the angels: ""Bow down to Adam"" and they bowed down. Not so Iblis: he refused and was haughty: He was of those who reject Faith.",,"['Divine Authority', 'Rebellion Disobedience']"
2|35,"We said: ""O Adam! dwell thou and thy wife in the Garden; and eat of the bountiful things therein as (where and when) ye will; but approach not this tree, or ye run into harm and transgression.""",,"['divine-guidance', 'moral-testing']"
2|36,"Then did Satan make them slip from the (garden), and get them out of the state (of felicity) in which they had been. We said: ""Get ye down, all (ye people), with enmity between yourselves. On earth will be your dwelling-place and your means of livelihood - for a time.""",,"['divine-justice', 'human-fallibility']"
2|37,"Then learnt Adam from his Lord words of inspiration, and his Lord Turned towards him; for He is Oft-Returning, Most Merciful.",,"['divine-mercy', 'repentance-forgiveness']"
2|38,"We said: ""Get ye down all from here; and if, as is sure, there comes to you Guidance from me, whosoever follows My guidance, on them shall be no fear, nor shall they grieve.",,"['divine-guidance', 'divine-mercy']"
2|39,"But those who reject Faith and belie Our Signs, they shall be companions of the Fire; they shall abide therein.",,"['divine-justice', 'hell-warning']"
2|40,"O Children of Israel! call to mind the (special) favour which I bestowed upon you, and fulfil your covenant with Me as I fulfil My Covenant with you, and fear none but Me.",,"['divine-mercy', 'covenant-faithfulness']"
2|41,"And believe in what I reveal, confirming the revelation which is with you, and be not the first to reject Faith therein, nor sell My Signs for a small price; and fear Me, and Me alone.",,"['Divine Revelation', 'Faithfulness Integrity']"
2|42,"And cover not Truth with falsehood, nor conceal the Truth when ye know (what it is).",,"['honesty-truth', 'truth-integrity']"
2|43,And be steadfast in prayer; practise regular charity; and bow down your heads with those who bow down (in worship).,,"['spiritual-connection', 'social-responsibility']"
2|44,"Do ye enjoin right conduct on the people, and forget (To practise it) yourselves, and yet ye study the Scripture? Will ye not understand?",,"['hypocrisy-warning', 'moral-accountability']"
2|45,"Nay, seek (Allah's) help with patient perseverance and prayer: It is indeed hard, except to those who bring a lowly spirit,-",,"['Patience-Perseverance', 'Humility-Submission']"
2|46,"Who bear in mind the certainty that they are to meet their Lord, and that they are to return to Him.",,"['divine-accountability', 'afterlife-consciousness']"
2|47,"Children of Israel! call to mind the (special) favour which I bestowed upon you, and that I preferred you to all other (for My Message).",,"['Divine Favor', 'Chosen People']"
2|48,"Then guard yourselves against a day when one soul shall not avail another nor shall intercession be accepted for her, nor shall compensation be taken from her, nor shall anyone be helped (from outside).",,"['divine-justice', 'day-judgment']"
2|49,"And remember, We delivered you from the people of Pharaoh: They set you hard tasks and punishments, slaughtered your sons and let your women-folk live; therein was a tremendous trial from your Lord.",,"['Divine Salvation', 'Trial and Testing']"
2|50,And remember We divided the sea for you and saved you and drowned Pharaoh's people within your very sight.,,"['divine-salvation', 'allah-power']"
2|51,"And remember We appointed forty nights for Moses, and in his absence ye took the calf (for worship), and ye did grievous wrong.",,"['Divine Covenant', 'Faithful Obedience']"
2|52,Even then We did forgive you; there was a chance for you to be grateful.,,"['allah-forgiveness', 'gratitude-thankfulness']"
2|53,And remember We gave Moses the Scripture and the Criterion (Between right and wrong): There was a chance for you to be guided aright.,,"['divine-guidance', 'spiritual-direction']"
2|54,"And remember Moses said to his people: ""O my people! Ye have indeed wronged yourselves by your worship of the calf: So turn (in repentance) to your Maker, and slay yourselves (the wrong-doers); that will be better for you in the sight of your Maker."" Then He turned towards you (in forgiveness): For He is Oft-Returning, Most Merciful.",,"['allah-forgiveness', 'repentance-mercy']"
2|55,"And remember ye said: ""O Moses! We shall never believe in thee until we see Allah manifestly,"" but ye were dazed with thunder and lighting even as ye looked on.",,"['Divine Manifestation', 'Faith Obstacles']"
2|56,Then We raised you up after your death: Ye had the chance to be grateful.,,"['divine-mercy', 'gratitude-thankfulness']"
2|57,"And We gave you the shade of clouds and sent down to you Manna and quails, saying: ""Eat of the good things We have provided for you:"" (But they rebelled); to us they did no harm, but they harmed their own souls.",,"['Divine Provision', 'Human Ingratitude']"
2|58,"And remember We said: ""Enter this town, and eat of the plenty therein as ye wish; but enter the gate with humility, in posture and in words, and We shall forgive you your faults and increase (the portion of) those who do good.""",,"['divine-forgiveness', 'humility-obedience']"
2|59,"But the transgressors changed the word from that which had been given them; so We sent on the transgressors a plague from heaven, for that they infringed (Our command) repeatedly.",,"['divine-punishment', 'disobedience-consequences']"
2|60,"And remember Moses prayed for water for his people; We said: ""Strike the rock with thy staff."" Then gushed forth therefrom twelve springs. Each group knew its own place for water. So eat and drink of the sustenance provided by Allah, and do no evil nor mischief on the (face of the) earth.",,"['Divine Provision', 'Moral Accountability']"
2|61,"And remember ye said: ""O Moses! we cannot endure one kind of food (always); so beseech thy Lord for us to produce for us of what the earth groweth, -its pot-herbs, and cucumbers, Its garlic, lentils, and onions."" He said: ""Will ye exchange the better for the worse? Go ye down to any town, and ye shall find what ye want!"" They were covered with humiliation and misery; they drew on themselves the wrath of Allah. This because they went on rejecting the Signs of Allah and slaying His Messengers without just cause. This because they rebelled and went on transgressing.",,"['divine-wrath', 'ingratitude-punishment']"
2|62,"Those who believe (in the Qur'an), and those who follow the Jewish (scriptures), and the Christians and the Sabians,- any who believe in Allah and the Last Day, and work righteousness, shall have their reward with their Lord; on them shall be no fear, nor shall they grieve.",,"['divine-mercy', 'righteous-reward']"
2|63,"And remember We took your covenant and We raised above you (The towering height) of Mount (Sinai): (Saying): ""Hold firmly to what We have given you and bring (ever) to remembrance what is therein: Perchance ye may fear Allah.""",,"['divine-covenant', 'allah-fear']"
2|64,"But ye turned back thereafter: Had it not been for the Grace and Mercy of Allah to you, ye had surely been among the lost.",,"['divine-mercy', 'human-fallibility']"
2|65,"And well ye knew those amongst you who transgressed in the matter of the Sabbath: We said to them: ""Be ye apes, despised and rejected.""",,"['Divine Punishment', 'Moral Consequences']"
2|66,"So We made it an example to their own time and to their posterity, and a lesson to those who fear Allah.",,"['divine-warning', 'moral-lessons']"
2|67,"And remember Moses said to his people: ""Allah commands that ye sacrifice a heifer."" They said: ""Makest thou a laughing-stock of us?"" He said: ""Allah save me from being an ignorant (fool)!""",,"['prophet-guidance', 'divine-obedience']"
2|68,"They said: ""Beseech on our behalf Thy Lord to make plain to us what (heifer) it is!"" He said; ""He says: The heifer should be neither too old nor too young, but of middling age. Now do what ye are commanded!""",,"['divine-guidance', 'obedience-commands']"
2|69,"They said: ""Beseech on our behalf Thy Lord to make plain to us Her colour."" He said: ""He says: A fawn-coloured heifer, pure and rich in tone, the admiration of beholders!""",,"['divine-guidance', 'obedience-specification']"
2|70,"They said: ""Beseech on our behalf Thy Lord to make plain to us what she is: To us are all heifers alike: We wish indeed for guidance, if Allah wills.""",,"['divine-guidance', 'human-uncertainty']"
2|71,"He said: ""He says: A heifer not trained to till the soil or water the fields; sound and without blemish."" They said: ""Now hast thou brought the truth."" Then they offered her in sacrifice, but not with good-will.",,"['divine-specification', 'sincere-obedience']"
2|72,Remember ye slew a man and fell into a dispute among yourselves as to the crime: But Allah was to bring forth what ye did hide.,,"['divine-justice', 'hidden-truth']"
2|73,"So We said: ""Strike the (body) with a piece of the (heifer)."" Thus Allah bringeth the dead to life and showeth you His Signs: Perchance ye may understand.",,"['divine-power', 'spiritual-understanding']"
2|74,Thenceforth were your hearts hardened: They became like a rock and even worse in hardness. For among rocks there are some from which rivers gush forth; others there are which when split asunder send forth water; and others which sink for fear of Allah. And Allah is not unmindful of what ye do.,,"['spiritual-hardness', 'divine-awareness']"
2|75,"Can ye (o ye men of Faith) entertain the hope that they will believe in you?- Seeing that a party of them heard the Word of Allah, and perverted it knowingly after they understood it.",,"['faith-doubt', 'divine-deception']"
2|76,"Behold! when they meet the men of Faith, they say: ""We believe"": But when they meet each other in private, they say: ""Shall you tell them what Allah hath revealed to you, that they may engage you in argument about it before your Lord?""- Do ye not understand (their aim)?",,"['hypocrisy-exposed', 'divine-knowledge']"
2|77,Know they not that Allah knoweth what they conceal and what they reveal?,,"['Divine Omniscience', 'Divine Justice']"
2|78,"And there are among them illiterates, who know not the Book, but (see therein their own) desires, and they do nothing but conjecture.",,"['false-knowledge', 'misguided-beliefs']"
2|79,"Then woe to those who write the Book with their own hands, and then say:""This is from Allah,"" to traffic with it for miserable price!- Woe to them for what their hands do write, and for the gain they make thereby.",,"['divine-justice', 'falsehood-condemnation']"
2|80,"And they say: ""The Fire shall not touch us but for a few numbered days:"" Say: ""Have ye taken a promise from Allah, for He never breaks His promise? or is it that ye say of Allah what ye do not know?""",,"['divine-promise', 'divine-justice']"
2|81,"Nay, those who seek gain in evil, and are girt round by their sins,- they are companions of the Fire: Therein shall they abide (For ever).",,"['Divine Justice', 'Moral Accountability']"
2|82,"But those who have faith and work righteousness, they are companions of the Garden: Therein shall they abide (For ever).",,"['Divine Reward', 'Eternal Salvation']"
2|83,"And remember We took a covenant from the Children of Israel (to this effect): Worship none but Allah; treat with kindness your parents and kindred, and orphans and those in need; speak fair to the people; be steadfast in prayer; and practise regular charity. Then did ye turn back, except a few among you, and ye backslide (even now).",,"['Covenant-Breach', 'Moral-Accountability']"
2|84,"And remember We took your covenant (to this effect): Shed no blood amongst you, nor turn out your own people from your homes: and this ye solemnly ratified, and to this ye can bear witness.",,"['Covenant-Breach', 'Social-Responsibility']"
2|85,"After this it is ye, the same people, who slay among yourselves, and banish a party of you from their homes; assist (Their enemies) against them, in guilt and rancour; and if they come to you as captives, ye ransom them, though it was not lawful for you to banish them. Then is it only a part of the Book that ye believe in, and do ye reject the rest? but what is the reward for those among you who behave like this but disgrace in this life?- and on the Day of Judgment they shall be consigned to the most grievous penalty. For Allah is not unmindful of what ye do.",,"['Divine Justice', 'Hypocrisy Condemnation']"
2|86,These are the people who buy the life of this world at the price of the Hereafter: their penalty shall not be lightened nor shall they be helped.,,"['Divine Justice', 'Afterlife Consequences']"
2|87,"We gave Moses the Book and followed him up with a succession of messengers; We gave Jesus the son of Mary Clear (Signs) and strengthened him with the holy spirit. Is it that whenever there comes to you a messenger with what ye yourselves desire not, ye are puffed up with pride?- Some ye called impostors, and others ye slay!",,"['prophet-rejection', 'divine-messengers']"
2|88,"They say, ""Our hearts are the wrappings (which preserve Allah's Word: we need no more)."" Nay, Allah's curse is on them for their blasphemy: Little is it they believe.",,"['Divine Rejection', 'Blasphemy Consequences']"
2|89,"And when there comes to them a Book from Allah, confirming what is with them,- although from of old they had prayed for victory against those without Faith,- when there comes to them that which they (should) have recognised, they refuse to believe in it but the curse of Allah is on those without Faith.",,"['Divine Rejection', 'Faithlessness Consequence']"
2|90,"Miserable is the price for which they have sold their souls, in that they deny (the revelation) which Allah has sent down, in insolent envy that Allah of His Grace should send it to any of His servants He pleases: Thus have they drawn on themselves Wrath upon Wrath. And humiliating is the punishment of those who reject Faith.",,"['Divine Wrath', 'Faith Rejection']"
2|91,"When it is said to them, ""Believe in what Allah Hath sent down, ""they say, ""We believe in what was sent down to us:"" yet they reject all besides, even if it be Truth confirming what is with them. Say: ""Why then have ye slain the prophets of Allah in times gone by, if ye did indeed believe?""",,"['Faith Hypocrisy', 'Prophetic Rejection']"
2|92,"There came to you Moses with clear (Signs); yet ye worshipped the calf (Even) after that, and ye did behave wrongfully.",,"['Prophetic Rejection', 'Idolatrous Behavior']"
2|93,"And remember We took your covenant and We raised above you (the towering height) of Mount (Sinai): (Saying): ""Hold firmly to what We have given you, and hearken (to the Law)"": They said:"" We hear, and we disobey:"" And they had to drink into their hearts (of the taint) of the calf because of their Faithlessness. Say: ""Vile indeed are the behests of your Faith if ye have any faith!""",,"['Covenant Betrayal', 'Divine Justice']"
2|94,"Say: ""If the last Home, with Allah, be for you specially, and not for anyone else, then seek ye for death, if ye are sincere.""",,"['sincerity-testing', 'divine-reward']"
2|95,"But they will never seek for death, on account of the (sins) which their hands have sent on before them. and Allah is well-acquainted with the wrong-doers.",,"['Divine Justice', 'Human Accountability']"
2|96,"Thou wilt indeed find them, of all people, most greedy of life,-even more than the idolaters: Each one of them wishes He could be given a life of a thousand years: But the grant of such life will not save him from (due) punishment. For Allah sees well all that they do.",,"['divine-justice', 'life-longing']"
2|97,"Say: Whoever is an enemy to Gabriel-for he brings down the (revelation) to thy heart by Allah's will, a confirmation of what went before, and guidance and glad tidings for those who believe,-",,"['Divine Revelation', 'Faith Opposition']"
2|98,"Whoever is an enemy to Allah and His angels and messengers, to Gabriel and Michael,- Lo! Allah is an enemy to those who reject Faith.",,"['Divine-Enmity', 'Faith-Rejection']"
2|99,We have sent down to thee Manifest Signs (ayat); and none reject them but those who are perverse.,,"['divine-guidance', 'faith-rejection']"
2|100,"Is it not (the case) that every time they make a covenant, some party among them throw it aside?- Nay, Most of them are faithless.",,"['faithlessness', 'covenant-breach']"
2|101,"And when there came to them a messenger from Allah, confirming what was with them, a party of the people of the Book threw away the Book of Allah behind their backs, as if (it had been something) they did not know!",,"['Divine Rejection', 'Scripture Disregard']"
2|102,"They followed what the evil ones gave out (falsely) against the power of Solomon: the blasphemers Were, not Solomon, but the evil ones, teaching men Magic, and such things as came down at babylon to the angels Harut and Marut. But neither of these taught anyone (Such things) without saying: ""We are only for trial; so do not blaspheme."" They learned from them the means to sow discord between man and wife. But they could not thus harm anyone except by Allah's permission. And they learned what harmed them, not what profited them. And they knew that the buyers of (magic) would have no share in the happiness of the Hereafter. And vile was the price for which they did sell their souls, if they but knew!",,"['Divine Permission', 'Spiritual Deception']"
2|103,"If they had kept their Faith and guarded themselves from evil, far better had been the reward from their Lord, if they but knew!",,"['divine-reward', 'righteous-living']"
2|104,"O ye of Faith! Say not (to the Messenger) words of ambiguous import, but words of respect; and hearken (to him): To those without Faith is a grievous punishment.",,"['Respect-Obedience', 'Divine-Punishment']"
2|105,"It is never the wish of those without Faith among the People of the Book, nor of the Pagans, that anything good should come down to you from your Lord. But Allah will choose for His special Mercy whom He will - for Allah is Lord of grace abounding.",,"['divine-mercy', 'allah-power']"
