ID,Abdullah Yusuf Ali,tag_1,tag_2
2|106,"None of Our revelations do We abrogate or cause to be forgotten, but We substitute something better or similar: Knowest thou not that Allah Hath power over all things?",,"['divine-power', 'revelation-wisdom']"
2|107,Knowest thou not that to Allah belongeth the dominion of the heavens and the earth? And besides Him ye have neither patron nor helper.,,"['Divine Sovereignty', 'Absolute Dependence']"
2|108,"Would ye question your Messenger as Moses was questioned of old? but whoever changeth from Faith to Unbelief, Hath strayed without doubt from the even way.",,"['faith-apostasy', 'prophetic-guidance']"
2|109,"Quite a number of the People of the Book wish they could Turn you (people) back to infidelity after ye have believed, from selfish envy, after the Truth hath become Manifest unto them: But forgive and overlook, Till Allah accomplish His purpose; for Allah Hath power over all things.",,"['divine-power', 'envy-infidelity']"
2|110,"And be steadfast in prayer and regular in charity: And whatever good ye send forth for your souls before you, ye shall find it with Allah: for Allah sees Well all that ye do.",,"['spiritual-connection', 'divine-reward']"
2|111,"And they say: ""None shall enter Paradise unless he be a Jew or a Christian."" Those are their (vain) desires. Say: ""Produce your proof if ye are truthful.""",,"['exclusivism-claims', 'divine-justice']"
2|112,"Nay,-whoever submits His whole self to Allah and is a doer of good,- He will get his reward with his Lord; on such shall be no fear, nor shall they grieve.",,"['divine-reward', 'sincere-submission']"
2|113,"The Jews say: ""The Christians have naught (to stand) upon; and the Christians say: ""The Jews have naught (To stand) upon."" Yet they (Profess to) study the (same) Book. Like unto their word is what those say who know not; but Allah will judge between them in their quarrel on the Day of Judgment.",,"['Divine Judgment', 'Interfaith Dispute']"
2|114,"And who is more unjust than he who forbids that in places for the worship of Allah, Allah's name should be celebrated?-whose zeal is (in fact) to ruin them? It was not fitting that such should themselves enter them except in fear. For them there is nothing but disgrace in this world, and in the world to come, an exceeding torment.",,"['Divine Justice', 'Worship Suppression']"
2|115,"To Allah belong the east and the West: Whithersoever ye turn, there is the presence of Allah. For Allah is all-Pervading, all-Knowing.",,"['divine-omnipresence', 'allah-power']"
2|116,"They say: ""Allah hath begotten a son"": Glory be to Him.-Nay, to Him belongs all that is in the heavens and on earth: everything renders worship to Him.",,"['Divine Sovereignty', ""Allah's Oneness""]"
2|117,"To Him is due the primal origin of the heavens and the earth: When He decreeth a matter, He saith to it: ""Be,"" and it is.",,"['Divine Power', 'Creation Origin']"
2|118,"Say those without knowledge: ""Why speaketh not Allah unto us? or why cometh not unto us a Sign?"" So said the people before them words of similar import. Their hearts are alike. We have indeed made clear the Signs unto any people who hold firmly to Faith (in their hearts).",,"['Divine Communication', 'Faith Requirement']"
2|119,Verily We have sent thee in truth as a bearer of glad tidings and a warner: But of thee no question shall be asked of the Companions of the Blazing Fire.,,"['divine-messenger', 'divine-justice']"
2|120,"Never will the Jews or the Christians be satisfied with thee unless thou follow their form of religion. Say: ""The Guidance of Allah,-that is the (only) Guidance."" Wert thou to follow their desires after the knowledge which hath reached thee, then wouldst thou find neither Protector nor helper against Allah.",,"['Divine Guidance', 'True Faith']"
2|121,"Those to whom We have sent the Book study it as it should be studied: They are the ones that believe therein: Those who reject faith therein,- the loss is their own.",,"['Divine Revelation', 'Faith Consequences']"
2|122,"O Children of Israel! call to mind the special favour which I bestowed upon you, and that I preferred you to all others (for My Message).",,"['Divine Favor', 'Chosen People']"
2|123,"Then guard yourselves against a Day when one soul shall not avail another, nor shall compensation be accepted from her nor shall intercession profit her nor shall anyone be helped (from outside).",,"['divine-justice', 'day-judgment']"
2|124,"And remember that Abraham was tried by his Lord with certain commands, which he fulfilled: He said: ""I will make thee an Imam to the Nations."" He pleaded: ""And also (Imams) from my offspring!"" He answered: ""But My Promise is not within the reach of evil-doers.""",,"['Divine Covenant', 'Prophetic Leadership']"
2|125,"Remember We made the House a place of assembly for men and a place of safety; and take ye the station of Abraham as a place of prayer; and We covenanted with Abraham and Isma'il, that they should sanctify My House for those who compass it round, or use it as a retreat, or bow, or prostrate themselves (therein in prayer).",,"['Divine Covenant', 'Sacred Spaces']"
2|126,"And remember Abraham said: ""My Lord, make this a City of Peace, and feed its people with fruits,-such of them as believe in Allah and the Last Day."" He said: ""(Yea), and such as reject Faith,-for a while will I grant them their pleasure, but will soon drive them to the torment of Fire,- an evil destination (indeed)!""",,"['divine-mercy', 'divine-justice']"
2|127,"And remember Abraham and Isma'il raised the foundations of the House (With this prayer): ""Our Lord! Accept (this service) from us: For Thou art the All-Hearing, the All-knowing.",,"['divine-acceptance', 'prophet-devotion']"
2|128,"Our Lord! make of us Muslims, bowing to Thy (Will), and of our progeny a people Muslim, bowing to Thy (will); and show us our place for the celebration of (due) rites; and turn unto us (in Mercy); for Thou art the Oft-Returning, Most Merciful.",,"['Divine Mercy', 'Spiritual Submission']"
2|129,"Our Lord! send amongst them a Messenger of their own, who shall rehearse Thy Signs to them and instruct them in scripture and wisdom, and sanctify them: For Thou art the Exalted in Might, the Wise.",,"['messenger-guidance', 'divine-mercy']"
2|130,And who turns away from the religion of Abraham but such as debase their souls with folly? Him We chose and rendered pure in this world: And he will be in the Hereafter in the ranks of the Righteous.,,"['Divine Election', 'Righteous Legacy']"
2|131,"Behold! his Lord said to him: ""Bow (thy will to Me):"" He said: ""I bow (my will) to the Lord and Cherisher of the Universe.""",,"['Divine Obedience', 'Surrender Faith']"
2|132,"And this was the legacy that Abraham left to his sons, and so did Jacob; ""Oh my sons! Allah hath chosen the Faith for you; then die not except in the Faith of Islam.""",,"['Faith Inheritance', 'Divine Guidance']"
2|133,"Were ye witnesses when death appeared before Jacob? Behold, he said to his sons: ""What will ye worship after me?"" They said: ""We shall worship Thy god and the god of thy fathers, of Abraham, Isma'il and Isaac,- the one (True) Allah: To Him we bow (in Islam).""",,"['Faith Inheritance', 'Monotheistic Devotion']"
2|134,"That was a people that hath passed away. They shall reap the fruit of what they did, and ye of what ye do! Of their merits there is no question in your case!",,"['Divine Justice', 'Personal Accountability']"
2|135,"They say: ""Become Jews or Christians if ye would be guided (To salvation)."" Say thou: ""Nay! (I would rather) the Religion of Abraham the True, and he joined not gods with Allah.""",,"['Religious Identity', 'Monotheistic Faith']"
2|136,"Say ye: ""We believe in Allah, and the revelation given to us, and to Abraham, Isma'il, Isaac, Jacob, and the Tribes, and that given to Moses and Jesus, and that given to (all) prophets from their Lord: We make no difference between one and another of them: And we bow to Allah (in Islam).""",,"['Prophetic Unity', 'Divine Submission']"
2|137,"So if they believe as ye believe, they are indeed on the right path; but if they turn back, it is they who are in schism; but Allah will suffice thee as against them, and He is the All-Hearing, the All-Knowing.",,"['Divine Support', 'Faith Division']"
2|138,(Our religion is) the Baptism of Allah: And who can baptize better than Allah? And it is He Whom we worship.,,"['Divine Sovereignty', 'Pure Worship']"
2|139,"Say: Will ye dispute with us about Allah, seeing that He is our Lord and your Lord; that we are responsible for our doings and ye for yours; and that We are sincere (in our faith) in Him?",,"['Divine Sovereignty', 'Personal Accountability']"
2|140,"Or do ye say that Abraham, Isma'il Isaac, Jacob and the Tribes were Jews or Christians? Say: Do ye know better than Allah? Ah! who is more unjust than those who conceal the testimony they have from Allah? but Allah is not unmindful of what ye do!",,"['Divine Knowledge', 'Truth Concealment']"
2|141,"That was a people that hath passed away. They shall reap the fruit of what they did, and ye of what ye do! Of their merits there is no question in your case:",,"['Divine Justice', 'Personal Accountability']"
2|142,"The fools among the people will say: ""What hath turned them from the Qibla to which they were used?"" Say: To Allah belong both east and West: He guideth whom He will to a Way that is straight.",,"['divine-guidance', 'allah-power']"
2|143,"Thus, have We made of you an Ummat justly balanced, that ye might be witnesses over the nations, and the Messenger a witness over yourselves; and We appointed the Qibla to which thou wast used, only to test those who followed the Messenger from those who would turn on their heels (From the Faith). Indeed it was (A change) momentous, except to those guided by Allah. And never would Allah Make your faith of no effect. For Allah is to all people Most surely full of kindness, Most Merciful.",,"['divine-guidance', 'community-purpose']"
2|144,"We see the turning of thy face (for guidance to the heavens: now Shall We turn thee to a Qibla that shall please thee. Turn then Thy face in the direction of the sacred Mosque: Wherever ye are, turn your faces in that direction. The people of the Book know well that that is the truth from their Lord. Nor is Allah unmindful of what they do.",,"['divine-guidance', 'worship-direction']"
2|145,"Even if thou wert to bring to the people of the Book all the Signs (together), they would not follow Thy Qibla; nor art thou going to follow their Qibla; nor indeed will they follow each other's Qibla. If thou after the knowledge hath reached thee, Wert to follow their (vain) desires,-then wert thou Indeed (clearly) in the wrong.",,"['Divine Guidance', 'Faithful Resolve']"
2|146,The people of the Book know this as they know their own sons; but some of them conceal the truth which they themselves know.,,"['Truth-Concealment', 'Knowledge-Accountability']"
2|147,The Truth is from thy Lord; so be not at all in doubt.,,"['Divine-Truth', 'Certainty-Faith']"
2|148,"To each is a goal to which Allah turns him; then strive together (as in a race) Towards all that is good. Wheresoever ye are, Allah will bring you Together. For Allah Hath power over all things.",,"['Divine Providence', 'Righteous Competition']"
2|149,"From whencesoever Thou startest forth, turn Thy face in the direction of the sacred Mosque; that is indeed the truth from the Lord. And Allah is not unmindful of what ye do.",,"['divine-guidance', 'sacred-direction']"
2|150,"So from whencesoever Thou startest forth, turn Thy face in the direction of the sacred Mosque; and wheresoever ye are, Turn your face thither: that there be no ground of dispute against you among the people, except those of them that are bent on wickedness; so fear them not, but fear Me; and that I may complete My favours on you, and ye May (consent to) be guided;",,"['divine-guidance', 'allah-mercy']"
2|151,"A similar (favour have ye already received) in that We have sent among you a Messenger of your own, rehearsing to you Our Signs, and sanctifying you, and instructing you in Scripture and Wisdom, and in new knowledge.",,"['divine-mercy', 'messenger-guidance']"
2|152,"Then do ye remember Me; I will remember you. Be grateful to Me, and reject not Faith.",,"['Divine Remembrance', 'Gratitude Faith']"
2|153,O ye who believe! seek help with patient perseverance and prayer; for Allah is with those who patiently persevere.,,"['Patience-Perseverance', 'Divine-Support']"
2|154,"And say not of those who are slain in the way of Allah: ""They are dead."" Nay, they are living, though ye perceive (it) not.",,"['life-after-death', 'divine-provision']"
2|155,"Be sure we shall test you with something of fear and hunger, some loss in goods or lives or the fruits (of your toil), but give glad tidings to those who patiently persevere,",,"['divine-testing', 'patience-perseverance']"
2|156,"Who say, when afflicted with calamity: ""To Allah We belong, and to Him is our return"":-",,"['patience-perseverance', 'divine-mercy']"
2|157,"They are those on whom (Descend) blessings from Allah, and Mercy, and they are the ones that receive guidance.",,"['divine-mercy', 'spiritual-guidance']"
2|158,"Behold! Safa and Marwa are among the Symbols of Allah. So if those who visit the House in the Season or at other times, should compass them round, it is no sin in them. And if any one obeyeth his own impulse to good,- be sure that Allah is He Who recogniseth and knoweth.",,"['divine-symbols', 'allah-mercy']"
2|159,"Those who conceal the clear (Signs) We have sent down, and the Guidance, after We have made it clear for the people in the Book,-on them shall be Allah's curse, and the curse of those entitled to curse,-",,"['divine-curse', 'truth-concealment']"
2|160,"Except those who repent and make amends and openly declare (the Truth): To them I turn; for I am Oft-returning, Most Merciful.",,"['allah-forgiveness', 'divine-mercy']"
2|161,"Those who reject Faith, and die rejecting,- on them is Allah's curse, and the curse of angels, and of all mankind;",,"['divine-punishment', 'faith-rejection']"
2|162,"They will abide therein: Their penalty will not be lightened, nor will respite be their (lot).",,"['divine-justice', 'hell-warning']"
2|163,"And your Allah is One Allah: There is no god but He, Most Gracious, Most Merciful.",,"['allah-unity', 'divine-mercy']"
2|164,"Behold! in the creation of the heavens and the earth; in the alternation of the night and the day; in the sailing of the ships through the ocean for the profit of mankind; in the rain which Allah Sends down from the skies, and the life which He gives therewith to an earth that is dead; in the beasts of all kinds that He scatters through the earth; in the change of the winds, and the clouds which they Trail like their slaves between the sky and the earth;- (Here) indeed are Signs for a people that are wise.",,"['divine-power', 'natural-signs']"
2|165,"Yet there are men who take (for worship) others besides Allah, as equal (with Allah): They love them as they should love Allah. But those of Faith are overflowing in their love for Allah. If only the unrighteous could see, behold, they would see the penalty: that to Allah belongs all power, and Allah will strongly enforce the penalty.",,"['Divine Love', ""Allah's Power""]"
2|166,"Then would those who are followed clear themselves of those who follow (them): They would see the penalty, and all relations between them would be cut off.",,"['divine-justice', 'social-consequences']"
2|167,"And those who followed would say: ""If only We had one more chance, We would clear ourselves of them, as they have cleared themselves of us."" Thus will Allah show them (The fruits of) their deeds as (nothing but) regrets. Nor will there be a way for them out of the Fire.",,"['divine-justice', 'regret-afterlife']"
2|168,"O ye people! Eat of what is on earth, Lawful and good; and do not follow the footsteps of the evil one, for he is to you an avowed enemy.",,"['righteous-living', 'divine-guidance']"
2|169,"For he commands you what is evil and shameful, and that ye should say of Allah that of which ye have no knowledge.",,"['Moral Corruption', 'False Attribution']"
2|170,"When it is said to them: ""Follow what Allah hath revealed:"" They say: ""Nay! we shall follow the ways of our fathers."" What! even though their fathers Were void of wisdom and guidance?",,"['blind-tradition', 'divine-guidance']"
2|171,"The parable of those who reject Faith is as if one were to shout Like a goat-herd, to things that listen to nothing but calls and cries: Deaf, dumb, and blind, they are void of wisdom.",,"['Faith Rejection', 'Spiritual Blindness']"
2|172,"O ye who believe! Eat of the good things that We have provided for you, and be grateful to Allah, if it is Him ye worship.",,"['gratitude-thankfulness', 'divine-provision']"
2|173,"He hath only forbidden you dead meat, and blood, and the flesh of swine, and that on which any other name hath been invoked besides that of Allah. But if one is forced by necessity, without wilful disobedience, nor transgressing due limits,- then is he guiltless. For Allah is Oft-forgiving Most Merciful.",,"['divine-forgiveness', 'halal-guidance']"
2|174,"Those who conceal Allah's revelations in the Book, and purchase for them a miserable profit,- they swallow into themselves naught but Fire; Allah will not address them on the Day of Resurrection. Nor purify them: Grievous will be their penalty.",,"['Divine Justice', 'Spiritual Corruption']"
2|175,They are the ones who buy Error in place of Guidance and Torment in place of Forgiveness. Ah! what boldness (They show) for the Fire!,,"['Divine Justice', 'Spiritual Deception']"
2|176,(Their doom is) because Allah sent down the Book in truth but those who seek causes of dispute in the Book are in a schism Far (from the purpose).,,"['Divine Revelation', 'Schism and Discord']"
2|177,"It is not righteousness that ye turn your faces Towards east or West; but it is righteousness- to believe in Allah and the Last Day, and the Angels, and the Book, and the Messengers; to spend of your substance, out of love for Him, for your kin, for orphans, for the needy, for the wayfarer, for those who ask, and for the ransom of slaves; to be steadfast in prayer, and practice regular charity; to fulfil the contracts which ye have made; and to be firm and patient, in pain (or suffering) and adversity, and throughout all periods of panic. Such are the people of truth, the Allah-fearing.",,"['Righteous Living', 'Faith and Charity']"
2|178,"O ye who believe! the law of equality is prescribed to you in cases of murder: the free for the free, the slave for the slave, the woman for the woman. But if any remission is made by the brother of the slain, then grant any reasonable demand, and compensate him with handsome gratitude, this is a concession and a Mercy from your Lord. After this whoever exceeds the limits shall be in grave penalty.",,"['divine-justice', 'mercy-forgiveness']"
2|179,"In the Law of Equality there is (saving of) Life to you, o ye men of understanding; that ye may restrain yourselves.",,"['divine-justice', 'self-restraint']"
2|180,"It is prescribed, when death approaches any of you, if he leave any goods that he make a bequest to parents and next of kin, according to reasonable usage; this is due from the Allah-fearing.",,"['family-responsibility', 'righteous-living']"
2|181,"If anyone changes the bequest after hearing it, the guilt shall be on those who make the change. For Allah hears and knows (All things).",,"['divine-justice', 'accountability-responsibility']"
2|182,"But if anyone fears partiality or wrong-doing on the part of the testator, and makes peace between (The parties concerned), there is no wrong in him: For Allah is Oft-forgiving, Most Merciful.",,"['divine-mercy', 'conflict-resolution']"
2|183,"O ye who believe! Fasting is prescribed to you as it was prescribed to those before you, that ye may (learn) self-restraint,-",,"['self-restraint', 'spiritual-discipline']"
2|184,"(Fasting) for a fixed number of days; but if any of you is ill, or on a journey, the prescribed number (Should be made up) from days later. For those who can do it (With hardship), is a ransom, the feeding of one that is indigent. But he that will give more, of his own free will,- it is better for him. And it is better for you that ye fast, if ye only knew.",,"['divine-mercy', 'self-restraint']"
2|185,"Ramadhan is the (month) in which was sent down the Qur'an, as a guide to mankind, also clear (Signs) for guidance and judgment (Between right and wrong). So every one of you who is present (at his home) during that month should spend it in fasting, but if any one is ill, or on a journey, the prescribed period (Should be made up) by days later. Allah intends every facility for you; He does not want to put to difficulties. (He wants you) to complete the prescribed period, and to glorify Him in that He has guided you; and perchance ye shall be grateful.",,"['divine-guidance', 'spiritual-facilitation']"
2|186,"When My servants ask thee concerning Me, I am indeed close (to them): I listen to the prayer of every suppliant when he calleth on Me: Let them also, with a will, Listen to My call, and believe in Me: That they may walk in the right way.",,"['divine-love', 'spiritual-connection']"
2|187,"Permitted to you, on the night of the fasts, is the approach to your wives. They are your garments and ye are their garments. Allah knoweth what ye used to do secretly among yourselves; but He turned to you and forgave you; so now associate with them, and seek what Allah Hath ordained for you, and eat and drink, until the white thread of dawn appear to you distinct from its black thread; then complete your fast Till the night appears; but do not associate with your wives while ye are in retreat in the mosques. Those are Limits (set by) Allah: Approach not nigh thereto. Thus doth Allah make clear His Signs to men: that they may learn self-restraint.",,"['divine-mercy', 'self-restraint']"
2|188,"And do not eat up your property among yourselves for vanities, nor use it as bait for the judges, with intent that ye may eat up wrongfully and knowingly a little of (other) people's property.",,"['property-protection', 'moral-accountability']"
2|189,"They ask thee concerning the New Moons. Say: They are but signs to mark fixed periods of time in (the affairs of) men, and for Pilgrimage. It is no virtue if ye enter your houses from the back: It is virtue if ye fear Allah. Enter houses through the proper doors: And fear Allah: That ye may prosper.",,"['Divine Guidance', 'Righteous Living']"
2|190,"Fight in the cause of Allah those who fight you, but do not transgress limits; for Allah loveth not transgressors.",,"['divine-justice', 'righteous-conduct']"
2|191,"And slay them wherever ye catch them, and turn them out from where they have Turned you out; for tumult and oppression are worse than slaughter; but fight them not at the Sacred Mosque, unless they (first) fight you there; but if they fight you, slay them. Such is the reward of those who suppress faith.",,"['divine-justice', 'religious-persecution']"
2|192,"But if they cease, Allah is Oft-forgiving, Most Merciful.",,"['allah-mercy', 'divine-forgiveness']"
2|193,"And fight them on until there is no more Tumult or oppression, and there prevail justice and faith in Allah; but if they cease, Let there be no hostility except to those who practise oppression.",,"['divine-justice', 'righteous-living']"
2|194,"The prohibited month for the prohibited month,- and so for all things prohibited,- there is the law of equality. If then any one transgresses the prohibition against you, Transgress ye likewise against him. But fear Allah, and know that Allah is with those who restrain themselves.",,"['Reciprocal Justice', 'Divine Restraint']"
2|195,"And spend of your substance in the cause of Allah, and make not your own hands contribute to (your) destruction; but do good; for Allah loveth those who do good.",,"['divine-love', 'righteous-living']"
2|196,"And complete the Hajj or 'umra in the service of Allah. But if ye are prevented (From completing it), send an offering for sacrifice, such as ye may find, and do not shave your heads until the offering reaches the place of sacrifice. And if any of you is ill, or has an ailment in his scalp, (Necessitating shaving), (He should) in compensation either fast, or feed the poor, or offer sacrifice; and when ye are in peaceful conditions (again), if any one wishes to continue the 'umra on to the hajj, He must make an offering, such as he can afford, but if he cannot afford it, He should fast three days during the hajj and seven days on his return, Making ten days in all. This is for those whose household is not in (the precincts of) the Sacred Mosque. And fear Allah, and know that Allah Is strict in punishment.",,"['Divine Obedience', 'Spiritual Compensation']"
2|197,"For Hajj are the months well known. If any one undertakes that duty therein, Let there be no obscenity, nor wickedness, nor wrangling in the Hajj. And whatever good ye do, (be sure) Allah knoweth it. And take a provision (With you) for the journey, but the best of provisions is right conduct. So fear Me, o ye that are wise.",,"['righteous-living', 'divine-knowledge']"
2|198,"It is no crime in you if ye seek of the bounty of your Lord (during pilgrimage). Then when ye pour down from (Mount) Arafat, celebrate the praises of Allah at the Sacred Monument, and celebrate His praises as He has directed you, even though, before this, ye went astray.",,"['divine-mercy', 'spiritual-connection']"
2|199,"Then pass on at a quick pace from the place whence it is usual for the multitude so to do, and ask for Allah's forgiveness. For Allah is Oft-forgiving, Most Merciful.",,"['allah-forgiveness', 'spiritual-connection']"
